{
  "schemaVersion": 1,
  "company": {
    "id": "10000000-0000-4000-8000-000000000001",
    "name": "Private"
  },
  "controller": "maxbec-delivery-controller",
  "controllerAgentId": "20000000-0000-4000-8000-000000000002",
  "projectId": "30000000-0000-4000-8000-000000000003",
  "infisical": {
    "sourceOfTruth": true,
    "projectId": "40000000-0000-4000-8000-000000000004",
    "environment": "production",
    "secretPath": "/flama/paperclip/private",
    "credentialSource": "infisical-oidc"
  },
  "paperclipSecretStorageException": {
    "key": "PAPERCLIP_ROUTINE_WEBHOOK_SECRET",
    "destination": "provider_native_secret",
    "reason": "Paperclip must retain the generated HMAC verifier copy for its public routine trigger.",
    "owner": "delivery-platform",
    "scope": "provider",
    "rotationDays": 90,
    "expiresAt": "2027-07-30",
    "reviewAfter": "2026-12-31",
    "status": "approved"
  },
  "mutationAllowed": true
}
